{
  "title": "Storing Many Values",
  "topic": "Arrays",
  "order": 1,
  "objectives": [
    "Create an array, fill it from the input and go through it with for and for-each.",
    "Use indexes to compare neighbours or move values around, without going past the end.",
    "Use a 2D array as a grid of rows and columns."
  ],
  "readings": [
    {
      "title": "How to Work with Arrays in Java",
      "source": "freeCodeCamp, The Java Handbook",
      "url": "https://www.freecodecamp.org/news/the-java-handbook/#heading-how-to-work-with-arrays-in-java",
      "type": "article",
      "minutes": 7,
      "lang": "en",
      "lookFor": "Creating an array, indexes from 0 to length − 1, looping over it, and the 2D example of a weekly medicine routine (rows and columns), for Matrix Sums and Tic-Tac-Toe Winner. The sort, fill and copy helpers at the end are optional. The handbook writes System.out.println inside public static void main; in Sphinx, IO.println and void main() do the same."
    }
  ],
  "translations": {
    "pt-br": {
      "title": "Guardando muitos valores",
      "objectives": [
        "Criar um array, preenchê-lo com a entrada e percorrê-lo com for e for-each.",
        "Usar índices para comparar vizinhos ou mudar valores de lugar, sem passar do fim.",
        "Usar um array 2D como uma grade de linhas e colunas."
      ],
      "readings": [
        {
          "lookFor": "Criar um array, índices de 0 a length − 1, percorrê-lo, e o exemplo 2D de uma rotina semanal de remédios (linhas e colunas), para Somas da matriz e Vencedor do jogo da velha. Os utilitários de ordenar, preencher e copiar no fim são opcionais. O livro escreve System.out.println dentro de public static void main; no Sphinx, IO.println e void main() fazem o mesmo."
        }
      ]
    }
  }
}
