{
  "title": "Making Decisions",
  "topic": "Conditionals",
  "order": 1,
  "objectives": [
    "Choose between paths with if, else if and else, with the conditions in the right order.",
    "Combine conditions with &&, || and !.",
    "Pick a value with the ternary operator and with a switch expression."
  ],
  "readings": [
    {
      "title": "How to Use Conditional Statements in Java",
      "source": "freeCodeCamp, The Java Handbook",
      "url": "https://www.freecodecamp.org/news/the-java-handbook/#heading-how-to-use-conditional-statements-in-java",
      "type": "article",
      "minutes": 6,
      "lang": "en",
      "lookFor": "if, else if and else, then the switch-case section right after. The handbook shows only the older switch with break; the dev.java reading shows the arrow form (case 6, 7 ->) the challenges use. The handbook writes System.out.println inside public static void main; in Sphinx, IO.println and void main() do the same."
    },
    {
      "title": "Branching with Switch Expressions",
      "source": "dev.java",
      "url": "https://dev.java/learn/language/constructs/basics/switch-expression/",
      "type": "article",
      "minutes": 5,
      "lang": "en",
      "lookFor": "Optional, for the switch challenges: the arrow form (case 6, 7 -> …) and a switch that gives a value. The parts on yield and null are more than you need now."
    }
  ],
  "translations": {
    "pt-br": {
      "title": "Tomando decisões",
      "objectives": [
        "Escolher entre caminhos com if, else if e else, com as condições na ordem certa.",
        "Combinar condições com &&, || e !.",
        "Escolher um valor com o operador ternário e com uma expressão switch."
      ],
      "readings": [
        {
          "lookFor": "if, else if e else, depois a seção de switch-case logo em seguida. O livro mostra só o switch antigo com break; a leitura do dev.java mostra a forma com seta (case 6, 7 ->) que os desafios usam. O livro escreve System.out.println dentro de public static void main; no Sphinx, IO.println e void main() fazem o mesmo."
        },
        {
          "lookFor": "Opcional, para os desafios com switch: a forma com seta (case 6, 7 -> …) e um switch que dá um valor. As partes sobre yield e null são mais do que você precisa agora."
        }
      ]
    }
  }
}
