{
  "title": "Writing Methods",
  "topic": "Methods",
  "order": 1,
  "objectives": [
    "Split a program into methods with parameters, and call them.",
    "Return a value from a method, or use void when it only does something.",
    "Overload a method: same name, different parameters."
  ],
  "readings": [
    {
      "title": "Methods in Java – Explained with Code Examples",
      "source": "freeCodeCamp",
      "url": "https://www.freecodecamp.org/news/java-methods/",
      "type": "article",
      "minutes": 6,
      "lang": "en",
      "lookFor": "Declaring a method, parameters, return values and void, and calling one from main. Its methods are static because its main is; with Sphinx's void main(), methods don't need static (in the classic style they do)."
    },
    {
      "title": "What is Method Overloading?",
      "source": "freeCodeCamp, The Java Handbook",
      "url": "https://www.freecodecamp.org/news/the-java-handbook/#heading-what-is-method-overloading",
      "type": "article",
      "minutes": 3,
      "lang": "en",
      "lookFor": "Optional, for Overloaded area(): methods can share a name when their parameters differ in number or type. A different return type alone isn't enough. The section is inside the handbook's Classes chapter; you only need this part."
    }
  ],
  "translations": {
    "pt-br": {
      "title": "Escrevendo métodos",
      "objectives": [
        "Dividir um programa em métodos com parâmetros, e chamá-los.",
        "Devolver um valor de um método, ou usar void quando ele só faz algo.",
        "Sobrecarregar um método: mesmo nome, parâmetros diferentes."
      ],
      "readings": [
        {
          "lookFor": "Declarar um método, parâmetros, valores de retorno e void, e chamá-lo a partir do main. Os métodos de lá são static porque o main de lá é; com o void main() do Sphinx, os métodos não precisam de static (no estilo clássico precisam)."
        },
        {
          "lookFor": "Opcional, para area() sobrecarregado: métodos podem ter o mesmo nome quando os parâmetros diferem em quantidade ou tipo. Só mudar o tipo de retorno não basta. A seção fica dentro do capítulo de classes do livro; você só precisa desta parte."
        }
      ]
    }
  }
}
