{
  "title": "Classes and Objects",
  "topic": "OOP",
  "order": 1,
  "objectives": [
    "Write a class with private fields, a constructor and methods, and create objects from it.",
    "Use a record for plain data and an enum for a fixed set of values.",
    "Share behaviour with inheritance and interfaces, and override methods such as toString."
  ],
  "readings": [
    {
      "title": "Classes and Objects in Java",
      "source": "freeCodeCamp, The Java Handbook",
      "url": "https://www.freecodecamp.org/news/the-java-handbook/#heading-classes-and-objects-in-java",
      "type": "article",
      "minutes": 15,
      "lang": "en",
      "lookFor": "Classes and objects, methods, constructors, getters and setters, then inheritance and overriding a method, for Shapes, Animals and Payroll. The handbook writes System.out.println inside public static void main; in Sphinx, IO.println and void main() do the same."
    }
  ],
  "translations": {
    "pt-br": {
      "title": "Classes e objetos",
      "objectives": [
        "Escrever uma classe com campos privados, um construtor e métodos, e criar objetos a partir dela.",
        "Usar um record para dados simples e um enum para um conjunto fixo de valores.",
        "Compartilhar comportamento com herança e interfaces, e sobrescrever métodos como toString."
      ],
      "readings": [
        {
          "lookFor": "Classes e objetos, métodos, construtores, getters e setters, depois herança e sobrescrita de métodos, para Formas, Animais e Folha de pagamento. O livro escreve System.out.println dentro de public static void main; no Sphinx, IO.println e void main() fazem o mesmo."
        }
      ]
    }
  }
}
